{
  "preflight_id": "preflight-abc-123",
  "total": 2,
  "already_present": 1,
  "needs_upload": 1,
  "conflicts": 0,
  "results": [
    {
      "index": 0,
      "status": "already_present",
      "michi_track_id": "a1b2c3d4-e5f6-7890-abcd-ef1234567890",
      "server_track_id": "c3d4e5f6-a7b8-9012-cdef-123456789012",
      "match_type": "exact_hash",
      "confidence": 1.0
    },
    {
      "index": 1,
      "status": "needs_upload",
      "michi_track_id": "b2c3d4e5-f6a7-8901-bcde-f12345678901",
      "match_type": "not_found",
      "confidence": 0.0
    }
  ]
}
